{
  "$schema": "https://json-schema.org/draft/2020-12/schema",
  "$id": "https://protostar.local/schema/factory-config.schema.json",
  "title": "FactoryConfig",
  "type": "object",
  "additionalProperties": false,
  "required": ["adapters"],
  "properties": {
    "adapters": {
      "type": "object",
      "additionalProperties": false,
      "required": ["coder", "judge"],
      "properties": {
        "coder": { "$ref": "#/definitions/lmstudioAdapterConfig" },
        "judge": { "$ref": "#/definitions/lmstudioAdapterConfig" }
      }
    },
    "delivery": {
      "type": "object",
      "description": "Phase 7 Q-15: operator-named CI check allowlist; empty/absent -> 'no-checks-configured' verdict. Phase 9 Q-20: delivery.mode controls ready-to-release delivery behavior.",
      "additionalProperties": false,
      "properties": {
        "mode": {
          "type": "string",
          "enum": ["auto", "gated"],
          "default": "auto",
          "description": "Phase 9 Q-20: 'auto' (default, preserves Phase 7) auto-delivers at ready-to-release. 'gated' pauses after writing delivery/authorization.json so an operator must invoke `protostar-factory deliver`."
        },
        "requiredChecks": {
          "type": "array",
          "items": { "type": "string", "minLength": 1 },
          "default": []
        }
      }
    },
    "evaluation": {
      "type": "object",
      "additionalProperties": false,
      "description": "Phase 8 Q-07/Q-08: heterogeneous-local judge model overrides. CLI flags --semantic-judge-model / --consensus-judge-model take precedence; Phase 6 Q-04 mode-resolution pattern.",
      "properties": {
        "semanticJudge": {
          "type": "object",
          "additionalProperties": false,
          "properties": {
            "model": { "type": "string", "minLength": 1 },
            "baseUrl": { "type": "string", "format": "uri" }
          }
        },
        "consensusJudge": {
          "type": "object",
          "additionalProperties": false,
          "properties": {
            "model": { "type": "string", "minLength": 1 },
            "baseUrl": { "type": "string", "format": "uri" }
          }
        }
      }
    },
    "evolution": {
      "type": "object",
      "additionalProperties": false,
      "description": "Phase 8 Q-15/Q-17/Q-18: lineage default, code-evolution opt-in, convergence threshold override. CLI flags --lineage / --evolve-code take precedence.",
      "properties": {
        "lineage": { "type": "string", "minLength": 1 },
        "codeEvolution": {
          "type": "string",
          "enum": [
            "opt-in",
            "disabled"
          ],
          "default": "disabled"
        },
        "convergenceThreshold": { "type": "number", "minimum": 0, "maximum": 1 }
      }
    },
    "operator": {
      "type": "object",
      "additionalProperties": false,
      "properties": {
        "livenessThresholdMs": {
          "type": "integer",
          "minimum": 1000,
          "maximum": 3600000,
          "default": 60000,
          "description": "Threshold in ms for run-liveness derivation; runs with manifest.status=running but no journal append within this window report state=orphaned in `protostar-factory status` (Phase 9 Q-09)."
        }
      }
    },
    "mechanicalChecks": {
      "type": "object",
      "additionalProperties": false,
      "description": "Review-loop mechanical command overrides. When omitted, archetype defaults are used.",
      "properties": {
        "commands": {
          "type": "array",
          "items": { "$ref": "#/definitions/mechanicalCheckCommand" }
        }
      }
    },
    "piles": {
      "type": "object",
      "description": "Phase 6 (Q-04) per-pile-kind mode selection. Precedence: CLI override (--planning-mode, --review-mode, --exec-coord-mode) > this config > built-in default. Built-in default mode is `fixture` per Q-05. Per Q-06, live failures NEVER auto-fall-back to fixture — they emit a no-admission refusal artifact and the run exits non-zero. Live mode is an explicit operator opt-in.",
      "additionalProperties": false,
      "properties": {
        "planning": {
          "type": "object",
          "additionalProperties": false,
          "description": "Planning pile (Q-04). CLI override flag: --planning-mode.",
          "properties": {
            "mode": {
              "enum": ["fixture", "live"],
              "default": "fixture",
              "description": "fixture (default per Q-05) or live. CLI flag --planning-mode overrides this value when explicitly provided. Live failure does NOT fall back to fixture (Q-06)."
            },
            "fixturePath": {
              "type": "string",
              "description": "Optional path to a fixture file used when mode=fixture."
            }
          }
        },
        "review": {
          "type": "object",
          "additionalProperties": false,
          "description": "Review pile (Q-04, Q-14). When mode=live, the review pile replaces the Phase 5 single-judge passthrough as the ModelReviewer implementation. CLI override flag: --review-mode.",
          "properties": {
            "mode": {
              "enum": ["fixture", "live"],
              "default": "fixture",
              "description": "fixture (default per Q-05) or live. CLI flag --review-mode overrides this value when explicitly provided. Live failure does NOT fall back to fixture (Q-06)."
            },
            "fixturePath": {
              "type": "string",
              "description": "Optional path to a fixture file used when mode=fixture."
            }
          }
        },
        "executionCoordination": {
          "type": "object",
          "additionalProperties": false,
          "description": "Execution-coordination pile (Q-04, Q-15). Both work-slicing and repair-plan triggers share this single preset/budget. CLI override flag: --exec-coord-mode. (JSON key uses camelCase to match TypeScript field names; the FactoryPileKind discriminator string is `execution-coordination`.)",
          "properties": {
            "mode": {
              "enum": ["fixture", "live"],
              "default": "fixture",
              "description": "fixture (default per Q-05) or live. CLI flag --exec-coord-mode overrides this value when explicitly provided. Live failure does NOT fall back to fixture (Q-06)."
            },
            "fixturePath": {
              "type": "string",
              "description": "Optional path to a fixture file used when mode=fixture."
            },
            "workSlicing": {
              "type": "object",
              "additionalProperties": false,
              "description": "Heuristic thresholds for shouldInvokeWorkSlicing(admittedPlan) (Q-15). Defaults are 3 / 5 (Claude's discretion per RESEARCH); Phase 8 will calibrate from dogfood data.",
              "properties": {
                "maxTargetFiles": {
                  "type": "number",
                  "default": 3,
                  "description": "If any task's targetFiles count exceeds this, work-slicing is invoked. Default 3."
                },
                "maxEstimatedTurns": {
                  "type": "number",
                  "default": 5,
                  "description": "If any task's estimatedTurns exceeds this, work-slicing is invoked. Default 5."
                }
              }
            }
          }
        }
      }
    }
  },
  "definitions": {
    "lmstudioAdapterConfig": {
      "type": "object",
      "additionalProperties": false,
      "required": ["provider", "baseUrl", "model", "apiKeyEnv"],
      "properties": {
        "provider": { "const": "lmstudio" },
        "baseUrl": { "type": "string" },
        "model": { "type": "string" },
        "apiKeyEnv": { "type": "string", "default": "LMSTUDIO_API_KEY" },
        "temperature": { "type": "number" },
        "topP": { "type": "number" }
      }
    },
    "mechanicalCheckCommand": {
      "type": "object",
      "additionalProperties": false,
      "required": ["id", "argv"],
      "properties": {
        "id": { "type": "string", "minLength": 1 },
        "argv": {
          "type": "array",
          "minItems": 1,
          "items": { "type": "string", "minLength": 1 }
        }
      }
    }
  }
}
